{
  "aidb_assessment": {
    "confidence": "medium",
    "novelty": "The key novelty is an explicit read-order contract: resolve overwritten relations into a current graph before traversing it to select provenance-linked original records. The fixed-extraction order control distinguishes this from merely refreshing values in an already selected context. The derived MQuAKE-MemStream dataset is also a useful controlled instrument, though its chronology is synthetic.",
    "rationale": "The central causal comparison is compelling: extraction, reader, prompt, and budget are fixed while evidence-selection order changes, and the effect persists across readers, retrieval controls, matched evidence length, and a second constructed dataset. Adoption should wait for independent confirmation on naturally occurring update streams, stronger entity resolution, immutable reader replication, and end-to-end cost evaluation.",
    "recommended_action": "read",
    "usefulness": "High for long-lived assistants whose memory can be represented as ordered, mostly single-valued relational assertions and whose serving architecture permits offline compilation. The method is less immediately applicable to ambiguous entities, simultaneous truths, multi-agent disagreement, open-ended dialogue, or adaptive multi-call retrieval."
  },
  "claims": [
    {
      "claim": "An update may change not only a value but also which downstream memory key and source record must be read.",
      "evidence": [
        {
          "block_id": "b00034-8c8bf0d4c1",
          "quote": "The second lookup must change from Room A’s floor to Room B’s floor."
        }
      ]
    },
    {
      "claim": "CMC resolves current relations before bounded traversal and returns the supporting original records for one reader call.",
      "evidence": [
        {
          "block_id": "b00038-ccdd4f1f3a",
          "quote": "For each question, it finds explicit subject anchors, traverses current outgoing edges up to five hops, and renders the supporting source records."
        },
        {
          "block_id": "b00040-d0e89a12b2",
          "quote": "The selected facts are returned as original text, together with unresolved records, for one frozen-reader generation."
        }
      ]
    },
    {
      "claim": "The read contract guarantees currency and bounded graph coverage only for selected interpreted edges, not semantic completeness of unresolved text.",
      "evidence": [
        {
          "block_id": "b00032-c8c684e581",
          "quote": "Currency: every edge in Ch is the last-written parsed edge for its key."
        },
        {
          "block_id": "b00032-c8c684e581",
          "quote": "Bounded graph coverage: every current outgoing edge in Gt from a subject reachable at depth less than h is included."
        },
        {
          "block_id": "b00032-c8c684e581",
          "quote": "These graph properties do not assign versions to unresolved source text retained alongside the selected edges."
        }
      ]
    },
    {
      "claim": "The primary mechanism comparison holds extraction, reader, prompt, histories, and evidence cap fixed while changing the records shown to the reader.",
      "evidence": [
        {
          "block_id": "b00058-43d9813cf7",
          "quote": "Every view uses the same source histories, HY4-preview reader, prompt, and 60,000-character evidence cap; only the evidence presented to the reader changes."
        }
      ]
    },
    {
      "claim": "MQuAKE-MemStream is a controlled supplied-memory test rather than a test of parametric knowledge editing or unrestricted evidence discovery.",
      "evidence": [
        {
          "block_id": "b00081-ef103b0198",
          "quote": "Every method receives the answer-bearing support facts, so this is a controlled test of version resolution and evidence selection rather than the original model-editing task."
        }
      ]
    },
    {
      "claim": "The demonstrated contribution is deliberately narrower than adaptive pipelines that can perform additional reads or modify memory state.",
      "evidence": [
        {
          "block_id": "b00302-0cf3edeab4",
          "quote": "These policies can issue further reads or change their stored state; the CMC mechanism comparison holds source extraction and the answer call fixed."
        }
      ]
    }
  ],
  "evaluation": {
    "ablations": [
      {
        "evidence": [
          {
            "block_id": "b00276-1b753170c8",
            "quote": "Multi-hop 400 21.50 78.25 56.75"
          }
        ],
        "text": "Ordering ablation: compare resolve-then-traverse with traversal on prior values followed by current-value refresh."
      },
      {
        "evidence": [
          {
            "block_id": "b00071-5befc7b4d8",
            "quote": "Stale closure keeps CMC’s selected relations but substitutes previous values where available"
          }
        ],
        "text": "Version-choice ablation: stale closure preserves selected keys while replacing active values with earlier ones."
      },
      {
        "evidence": [
          {
            "block_id": "b00280-6f143cd6cd",
            "quote": "We vary the traversal cap over h∈{1,2,3,5} while keeping the LLM extraction, current-state construction, anchors, source-record renderer, 60,000-character cap, and HY4 reader fixed."
          }
        ],
        "text": "Traversal-depth ablation evaluates one-, two-, three-, and five-hop caps under otherwise fixed conditions."
      },
      {
        "evidence": [
          {
            "block_id": "b00221-74e2424fd1",
            "quote": "The grammar adapter uses manually specified patterns; direct LLM extraction names relations from source records; the hybrid induces literal patterns from source examples."
          }
        ],
        "text": "Frontend ablation compares a manually specified grammar adapter, direct LLM extraction, and a source-induced hybrid using the same CMC read and reader."
      },
      {
        "evidence": [
          {
            "block_id": "b00241-fa28705229",
            "quote": "Only the reader and its chat template change: Qwen3.5-4B"
          },
          {
            "block_id": "b00245-e7e04f147a",
            "quote": "This is a reader replacement on fixed extracted evidence."
          }
        ],
        "text": "Reader ablation swaps HY4-preview for Qwen3.5-4B and Llama-3.1-8B while reusing fixed extraction and evidence."
      },
      {
        "evidence": [
          {
            "block_id": "b00254-0126ab9e0e",
            "quote": "For each question, its evidence allowance equals the cl100k token count of CMC’s rendered evidence"
          }
        ],
        "text": "Evidence-budget ablation compares CMC with BM25 packed to each question’s CMC evidence allowance."
      }
    ],
    "baselines": [
      {
        "evidence": [
          {
            "block_id": "b00272-b5a9bc747f",
            "quote": "We traverse the constructed graph to depth five, then replace each selected key’s value with its current assertion."
          },
          {
            "block_id": "b00272-b5a9bc747f",
            "quote": "Thus all returned parsed facts are current, while the selected keys can differ."
          }
        ],
        "text": "Prior read + refresh: traverse a graph built from earlier differing values, then replace selected values with current assertions; isolates selection before update resolution."
      },
      {
        "evidence": [
          {
            "block_id": "b00191-3897a138a1",
            "quote": "Stale closure takes the closure our compiler admitted and substitutes the immediately preceding version when one exists"
          }
        ],
        "text": "Stale closure: hold CMC’s selected keys fixed but substitute immediately preceding versions where available; isolates version choice."
      },
      {
        "evidence": [
          {
            "block_id": "b00265-53a9242514",
            "quote": "The latest-state control returns all current assertions."
          },
          {
            "block_id": "b00265-53a9242514",
            "quote": "The raw-history control retains every version before applying the reader’s window policy."
          }
        ],
        "text": "Latest state and raw history: present all current assertions or retained history subject to the reader window and rendering policy."
      },
      {
        "evidence": [
          {
            "block_id": "b00237-0d59ca7953",
            "quote": "Fact BM25, size matched 97.00 7.25 182 0 Fact dense (BGE-M3) 96.50 33.25 1,535 0"
          },
          {
            "block_id": "b00206-a3b0dadd11",
            "quote": "Qwen3-Embedding-8B dense top-100 retrieval, Qwen3-Reranker-4B top-10 reranking"
          }
        ],
        "text": "Lexical and dense retrieval over current facts: fact BM25, size-matched BM25, BGE-M3, and a dense-plus-reranker pipeline."
      },
      {
        "evidence": [
          {
            "block_id": "b00212-6965d720d1",
            "quote": "The disjoint random negative control draws from the active state while excluding the query projection keys, matching cardinality exactly on all 800 questions"
          }
        ],
        "text": "A disjoint random negative control excludes CMC-selected keys while matching evidence cardinality."
      },
      {
        "evidence": [
          {
            "block_id": "b00200-3bc8938e8e",
            "quote": "The G-Walk and MeLLo rows in Table 5 use the released MQuAKE-Remastered implementations and prompts"
          },
          {
            "block_id": "b00247-518fa1e721",
            "quote": "Both systems receive the original histories and use HY4-preview."
          }
        ],
        "text": "End-to-end and ported comparisons include adapted SH-Conflict/CAR, G-Walk, MeLLo, suffix retrieval, BM25, dense+BM25, and published MemoryAgentBench systems."
      }
    ],
    "datasets": [